{"$schema":"https://json-schema.org/draft/2020-12/schema","$id":"https://simplevtt.local/schemas/golden-scenario.schema.json","title":"SimpleVTT Golden Scenario","type":"object","required":["schemaVersion","id","profile","modules","initialState","request","fixedDice","choices","expected"],"properties":{"schemaVersion":{"const":"0.1-draft"},"id":{"type":"string","pattern":"^[a-z0-9][a-z0-9._-]*$"},"description":{"type":"string"},"profile":{"type":"object","required":["id","version"],"properties":{"id":{"type":"string"},"version":{"type":"string"}},"additionalProperties":false},"modules":{"type":"array","items":{"type":"object","required":["id","version"],"properties":{"id":{"type":"string"},"version":{"type":"string"}},"additionalProperties":false}},"initialState":{"type":"object"},"request":{"type":"object","required":["kind"],"properties":{"kind":{"type":"string"},"actorId":{"type":"string"},"targetIds":{"type":"array","items":{"type":"string"}},"payload":{"type":"object"}},"additionalProperties":false},"fixedDice":{"type":"array","items":{"type":"object","required":["id","purpose","sides","faces"],"properties":{"id":{"type":"string"},"purpose":{"type":"string"},"sides":{"type":"integer","minimum":2},"faces":{"type":"array","minItems":1,"items":{"type":"integer","minimum":1}},"selectedIndexes":{"type":"array","items":{"type":"integer","minimum":0}}},"additionalProperties":false}},"choices":{"type":"array","items":{"type":"object"}},"expected":{"type":"object","properties":{"result":{"type":"object"},"resolvedProperties":{"type":"object","additionalProperties":{"type":["number","integer","boolean","string"]}},"stateChanges":{"type":"array","items":{"type":"object"}},"provenanceAssertions":{"type":"array","items":{"type":"object","required":["source","status"],"properties":{"source":{"type":"string"},"status":{"enum":["applied","suppressed","superseded","inactive","failed-predicate","cancelled"]},"reason":{"type":"string"}},"additionalProperties":false}}},"additionalProperties":false},"$schema":{"type":"string","format":"uri"}},"additionalProperties":false}
