{"$schema":"https://simplevtt.local/schemas/golden-scenario.schema.json","schemaVersion":"0.1-draft","id":"profile.d20.ability-check.advantage","description":"An ability check with Advantage selects the higher fixed d20 and succeeds when total meets DC.","profile":{"id":"dnd.srd-5.2.1","version":"0.1-draft"},"modules":[{"id":"dnd.srd-5.2.1.core","version":"0.1-draft"}],"initialState":{"actors":{"hero":{"rollStateContributions":[{"source":"test.advantage","state":"advantage"}]}}},"request":{"kind":"d20-test","actorId":"hero","payload":{"family":"ability-check","target":15,"modifierContributions":[{"source":"hero.ability.str.modifier","value":3},{"source":"hero.skill.athletics.proficiency","value":2}],"targetSource":"gm:dc"}},"fixedDice":[{"id":"roll.ability","purpose":"ability-check","sides":20,"faces":[4,17],"selectedIndexes":[1]}],"choices":[],"expected":{"result":{"family":"ability-check","rollState":"advantage","natural":17,"modifier":5,"total":22,"target":15,"outcome":"success","critical":false,"selectedIndexes":[1]},"provenanceAssertions":[{"source":"test.advantage","status":"applied","reason":"advantage contribution applied"}]}}
