{"$schema":"https://simplevtt.local/schemas/golden-scenario.schema.json","schemaVersion":"0.1-draft","id":"profile.advantage-disadvantage.cancel","description":"At least one Advantage and one Disadvantage contribution cancel to normal while both sources remain visible in provenance.","profile":{"id":"dnd.srd-5.2.1","version":"0.1-draft"},"modules":[{"id":"dnd.srd-5.2.1.core","version":"0.1-draft"}],"initialState":{"actors":{"hero":{"rollStateContributions":[{"source":"test.advantage","state":"advantage"},{"source":"test.disadvantage","state":"disadvantage"}]}}},"request":{"kind":"roll-state-resolution","actorId":"hero","payload":{"testFamily":"ability-check"}},"fixedDice":[],"choices":[],"expected":{"result":{"rollState":"normal"},"provenanceAssertions":[{"source":"test.advantage","status":"suppressed","reason":"cancelled by opposing Disadvantage contribution"},{"source":"test.disadvantage","status":"suppressed","reason":"cancelled by opposing Advantage contribution"}]}}
