{"$schema":"https://simplevtt.local/schemas/golden-scenario.schema.json","schemaVersion":"0.1-draft","id":"profile.ability-modifier.basic","description":"Strength 15 resolves to a +2 ability modifier using floor((score - 10) / 2).","profile":{"id":"dnd.srd-5.2.1","version":"0.1-draft"},"modules":[{"id":"dnd.srd-5.2.1.core","version":"0.1-draft"}],"initialState":{"actors":{"hero":{"properties":{"ability.str.score":15}}}},"request":{"kind":"property-resolution","actorId":"hero","payload":{"property":"ability.str.modifier"}},"fixedDice":[],"choices":[],"expected":{"resolvedProperties":{"ability.str.modifier":2},"provenanceAssertions":[{"source":"profile:dnd.srd-5.2.1/dnd.rounding.default-floor","status":"applied","reason":"floor((15 - 10) / 2) = 2"}]}}
